{
  "schema_version": "mainframe-env.jcl-planner-semantics@1",
  "target_version": "0.7.0",
  "source_catalog": "conformance/0.2/catalogs/jcl-jes2.json",
  "generated_coverage_credit": 0,
  "families": {
    "jcl-statements": {
      "capability_prefix": "jcl.statement",
      "default": {"validation": "none", "support": "available"},
      "rules": {
        "JCL-COMMAND": {"validation": "jcl-value", "support": "deferred", "capability": "jes.operator.command"},
        "COMMAND": {"validation": "jcl-value", "support": "deferred", "capability": "jes.operator.command"},
        "CNTL": {"validation": "none", "support": "deferred", "capability": "jcl.program-control"},
        "ENDCNTL": {"validation": "none", "support": "deferred", "capability": "jcl.program-control"},
        "SCHEDULE": {"validation": "jcl-value", "support": "deferred", "capability": "jes.schedule.annotation"},
        "XMIT": {"validation": "jcl-value", "support": "deferred", "capability": "jes.nje.transmit"}
      }
    },
    "jes2-jecl-statements": {
      "capability_prefix": "jes2.statement",
      "default": {"validation": "jcl-value", "support": "deferred"},
      "rules": {
        "$": {"validation": "jcl-value", "support": "deferred", "capability": "jes2.operator.command"},
        "JOBPARM": {"validation": "jcl-value", "support": "deferred"},
        "MESSAGE": {"validation": "text", "support": "deferred"},
        "NETACCT": {"validation": "text", "support": "deferred"},
        "NOTIFY": {"validation": "name", "support": "deferred"},
        "OUTPUT": {"validation": "jcl-value", "support": "deferred"},
        "PRIORITY": {"validation": "integer", "minimum": 0, "maximum": 15, "support": "deferred"},
        "ROUTE": {"validation": "jcl-value", "support": "deferred"},
        "SETUP": {"validation": "name-list", "support": "deferred"},
        "SIGNOFF": {"validation": "none", "support": "deferred"},
        "SIGNON": {"validation": "jcl-value", "support": "deferred"},
        "XEQ": {"validation": "name", "support": "deferred"},
        "XMIT": {"validation": "jcl-value", "support": "deferred"}
      }
    },
    "dd-parameters": {
      "capability_prefix": "jcl.dd",
      "default": {"validation": "jcl-value", "support": "deferred"},
      "rules": {
        "*": {"validation": "none", "support": "available", "capability": "jcl.inline-data"},
        "ACCODE": {"validation": "name", "support": "deferred"},
        "AVGREC": {"validation": "enum", "choices": ["U", "K", "M"], "support": "deferred"},
        "BLKSIZE": {"validation": "integer", "minimum": 0, "maximum": 2147483647, "support": "available"},
        "BLKSZLIM": {"validation": "integer", "minimum": 0, "maximum": 2147483647, "support": "deferred"},
        "BURST": {"validation": "boolean", "support": "deferred"},
        "CCSID": {"validation": "integer", "minimum": 1, "maximum": 65535, "support": "available"},
        "CHKPT": {"validation": "jcl-value", "support": "deferred"},
        "COPIES": {"validation": "integer-or-tuple", "minimum": 1, "maximum": 255, "support": "deferred"},
        "DATA": {"validation": "none", "support": "available", "capability": "jcl.inline-data"},
        "DATACLAS": {"validation": "name", "support": "deferred"},
        "DCB": {"validation": "jcl-value", "support": "available"},
        "DDNAME": {"validation": "backward-reference", "support": "available"},
        "DEST": {"validation": "name", "support": "deferred"},
        "DISP": {"validation": "disposition", "support": "available"},
        "DLM": {"validation": "delimiter", "support": "available"},
        "DSID": {"validation": "integer", "minimum": 1, "maximum": 999999, "support": "deferred"},
        "DSKEYLBL": {"validation": "name", "support": "deferred"},
        "DSNAME": {"validation": "dataset", "support": "available", "capability": "dataset.allocation"},
        "DSNTYPE": {"validation": "enum", "choices": ["BASIC", "EXTREQ", "EXTPREF", "LARGE", "LIBRARY", "PDS"], "support": "available"},
        "DUMMY": {"validation": "none", "support": "available"},
        "EATTR": {"validation": "enum", "choices": ["NO", "OPT"], "support": "deferred"},
        "FILEDATA": {"validation": "enum", "choices": ["BINARY", "RECORD", "TEXT"], "support": "deferred"},
        "FREE": {"validation": "enum", "choices": ["CLOSE", "END"], "support": "deferred"},
        "FREEVOL": {"validation": "enum", "choices": ["EOV"], "support": "deferred"},
        "GDGORDER": {"validation": "enum", "choices": ["FIFO", "LIFO", "USECATLG"], "support": "deferred"},
        "HOLD": {"validation": "boolean", "support": "deferred"},
        "KEYLEN": {"validation": "integer", "minimum": 0, "maximum": 32760, "support": "deferred"},
        "KEYOFF": {"validation": "integer", "minimum": 0, "maximum": 32760, "support": "deferred"},
        "LRECL": {"validation": "integer-or-x", "minimum": 1, "maximum": 2147483647, "support": "available"},
        "MAXGENS": {"validation": "integer", "minimum": 0, "maximum": 2000000000, "support": "deferred"},
        "MGMTCLAS": {"validation": "name", "support": "deferred"},
        "OUTLIM": {"validation": "integer", "minimum": 0, "maximum": 16777215, "support": "deferred"},
        "OUTPUT": {"validation": "output-reference", "support": "available"},
        "PATH": {"validation": "path", "support": "deferred"},
        "PATHDISP": {"validation": "jcl-value", "support": "deferred"},
        "PATHMODE": {"validation": "jcl-value", "support": "deferred"},
        "PATHOPTS": {"validation": "jcl-value", "support": "deferred"},
        "PROTECT": {"validation": "boolean", "support": "deferred"},
        "RECFM": {"validation": "record-format", "support": "available"},
        "RECORG": {"validation": "enum", "choices": ["KS", "ES", "RR", "LS"], "support": "deferred"},
        "REFDD": {"validation": "backward-reference", "support": "deferred"},
        "RETPD": {"validation": "integer", "minimum": 0, "maximum": 9999, "support": "deferred"},
        "RLS": {"validation": "enum", "choices": ["NRI", "CR", "CRE"], "support": "deferred"},
        "SEGMENT": {"validation": "integer", "minimum": 1, "maximum": 2147483647, "support": "deferred"},
        "SPIN": {"validation": "enum", "choices": ["NO", "UNALLOC"], "support": "deferred"},
        "STORCLAS": {"validation": "name", "support": "deferred"},
        "SYMBOLS": {"validation": "enum", "choices": ["CNVTSYS", "EXECSYS", "JCLONLY", "NO"], "support": "deferred"},
        "SYMLIST": {"validation": "name-list", "support": "deferred"},
        "SYSOUT": {"validation": "sysout", "support": "available", "capability": "jes.sysout.route"},
        "TERM": {"validation": "enum", "choices": ["TS", "NOTS"], "support": "deferred"},
        "UNIT": {"validation": "jcl-value", "support": "deferred"},
        "VOLUME": {"validation": "jcl-value", "support": "deferred"}
      }
    },
    "exec-parameters": {
      "capability_prefix": "jcl.exec",
      "default": {"validation": "jcl-value", "support": "deferred"},
      "rules": {
        "ADDRSPC": {"validation": "enum", "choices": ["REAL", "VIRT"], "support": "deferred"},
        "CCSID": {"validation": "integer", "minimum": 1, "maximum": 65535, "support": "available"},
        "COND": {"validation": "condition", "support": "available"},
        "DYNAMNBR": {"validation": "integer", "minimum": 0, "maximum": 3273, "support": "deferred"},
        "MEMLIMIT": {"validation": "size", "support": "deferred"},
        "PARM": {"validation": "text", "support": "available"},
        "PARMDD": {"validation": "name", "support": "deferred"},
        "PERFORM": {"validation": "integer", "minimum": 1, "maximum": 999, "support": "deferred"},
        "PGM": {"validation": "program", "support": "available", "capability": "host.program.invoke"},
        "PROC": {"validation": "procedure", "support": "available", "capability": "jcl.procedure.expand"},
        "RD": {"validation": "enum", "choices": ["NC", "NR", "R", "RNC"], "support": "deferred"},
        "REGION": {"validation": "size", "support": "deferred"},
        "REGIONX": {"validation": "size-or-tuple", "support": "deferred"},
        "TIME": {"validation": "time", "support": "deferred"},
        "TVSMSG": {"validation": "enum", "choices": ["0", "1"], "support": "deferred"},
        "TVSAMCOM": {"validation": "enum", "choices": ["NO", "YES"], "support": "deferred"}
      }
    },
    "job-parameters": {
      "capability_prefix": "jcl.job",
      "default": {"validation": "jcl-value", "support": "deferred"},
      "rules": {
        "POSITIONAL-ACCOUNTING": {"validation": "text", "support": "available"},
        "POSITIONAL-PROGRAMMER": {"validation": "text", "support": "available"},
        "ADDRSPC": {"validation": "enum", "choices": ["REAL", "VIRT"], "support": "deferred"},
        "BYTES": {"validation": "integer-or-suffix", "minimum": 0, "maximum": 2147483647, "support": "deferred"},
        "CARDS": {"validation": "integer-or-suffix", "minimum": 0, "maximum": 2147483647, "support": "deferred"},
        "CCSID": {"validation": "integer", "minimum": 1, "maximum": 65535, "support": "available"},
        "CLASS": {"validation": "class", "support": "available"},
        "COND": {"validation": "condition", "support": "available"},
        "DSENQSHR": {"validation": "enum", "choices": ["ALLOW", "DISALLOW", "USEJC"], "support": "deferred"},
        "GDGBIAS": {"validation": "enum", "choices": ["JOB", "STEP"], "support": "deferred"},
        "JESLOG": {"validation": "enum", "choices": ["SPIN", "SUPPRESS"], "support": "deferred"},
        "LINES": {"validation": "integer-or-suffix", "minimum": 0, "maximum": 2147483647, "support": "deferred"},
        "MEMLIMIT": {"validation": "size", "support": "deferred"},
        "MSGCLASS": {"validation": "class", "support": "available"},
        "MSGLEVEL": {"validation": "message-level", "support": "available"},
        "NOTIFY": {"validation": "name", "support": "deferred"},